{
  "contract_version": "1.0",
  "request_id": "a0000000-0000-4000-8000-000000000001",
  "requested_at": "2026-09-18T11:55:00.000Z",
  "expires_at": "2027-01-01T00:00:00.000Z",
  "actor": { "type": "user", "id": "user-1", "auth_ref": "usr:session-1" },
  "intent": "Minimal valid request",
  "domain": "core",
  "action": "core.generate_strategy"
}
